<university
        xmlns="http://example.com/"
        xmlns:xsi="http://www.w3.org/2001/XMLSchema-instance"
        xsi:schemaLocation="http://example.com/ TestXSD.xsd"
        universityName="str1234">
    <administration>
        <departmentName>string</departmentName>
        <!--1 to 5 repetitions:-->
        <boss>
            <name>string</name>
            <surname>string</surname>
            <patronim>string</patronim>
            <dateOfBirth>2008-09-29</dateOfBirth>
            <employeeDoc>
                <docID>201</docID>
            </employeeDoc>
        </boss>
        <!--1 to 500 repetitions:-->
        <departmentEmployee>
            <name>string</name>
            <surname>string</surname>
            <patronim>string</patronim>
            <dateOfBirth>2014-09-19</dateOfBirth>
            <employeeDoc>
                <docID>201</docID>
            </employeeDoc>
        </departmentEmployee>
        <bookkeeping>
            <departmentName>string</departmentName>
            <!--1 to 5 repetitions:-->
            <boss>
                <name>string</name>
                <surname>string</surname>
                <patronim>string</patronim>
                <dateOfBirth>2006-08-19+04:00</dateOfBirth>
                <employeeDoc>
                    <docID>201</docID>
                </employeeDoc>
            </boss>
            <!--1 to 500 repetitions:-->
            <departmentEmployee>
                <name>string</name>
                <surname>string</surname>
                <patronim>string</patronim>
                <dateOfBirth>2009-05-16</dateOfBirth>
                <employeeDoc>
                    <docID>201</docID>
                </employeeDoc>
            </departmentEmployee>
        </bookkeeping>
        <departmentOfScientific>
            <departmentName>string</departmentName>
            <!--1 to 5 repetitions:-->
            <boss>
                <name>string</name>
                <surname>string</surname>
                <patronim>string</patronim>
                <dateOfBirth>2003-08-09+04:00</dateOfBirth>
                <employeeDoc>
                    <docID>201</docID>
                </employeeDoc>
            </boss>
            <!--1 to 500 repetitions:-->
            <departmentEmployee>
                <name>string</name>
                <surname>string</surname>
                <patronim>string</patronim>
                <dateOfBirth>2012-09-13+04:00</dateOfBirth>
                <employeeDoc>
                    <docID>201</docID>
                </employeeDoc>
            </departmentEmployee>
            <library>
                <departmentName>string</departmentName>
                <!--1 to 5 repetitions:-->
                <boss>
                    <name>string</name>
                    <surname>string</surname>
                    <patronim>string</patronim>
                    <dateOfBirth>2009-10-14</dateOfBirth>
                    <employeeDoc>
                        <docID>201</docID>
                    </employeeDoc>
                </boss>
                <!--1 to 500 repetitions:-->
                <departmentEmployee>
                    <name>string</name>
                    <surname>string</surname>
                    <patronim>string</patronim>
                    <dateOfBirth>2010-03-18</dateOfBirth>
                    <employeeDoc>
                        <docID>201</docID>
                    </employeeDoc>
                </departmentEmployee>
                <!--You have a CHOICE of the next 2 items at this level-->
                <book>
                    <bookID>201</bookID>
                    <title>string</title>
                    <state>true</state>
                    <bookID>201</bookID>
                    <title>string</title>
                    <state>true</state>
                    <bookID>201</bookID>
                    <title>string</title>
                    <state>false</state>
                    <bookID>201</bookID>
                    <title>string</title>
                    <state>false</state>
                    <bookID>201</bookID>
                    <title>string</title>
                    <state>true</state>
                    <bookID>201</bookID>
                    <title>string</title>
                    <state>false</state>
                    <bookID>201</bookID>
                    <title>string</title>
                    <state>false</state>
                    <bookID>201</bookID>
                    <title>string</title>
                    <state>false</state>
                    <bookID>201</bookID>
                    <title>string</title>
                    <state>false</state>
                    <bookID>201</bookID>
                    <title>string</title>
                    <state>true</state>
                </book>
            </library>
            <educationalMethodicalDepartment>
                <departmentName>string</departmentName>
                <!--1 to 5 repetitions:-->
                <boss>
                    <name>string</name>
                    <surname>string</surname>
                    <patronim>string</patronim>
                    <dateOfBirth>2015-08-24</dateOfBirth>
                    <employeeDoc>
                        <docID>201</docID>
                    </employeeDoc>
                </boss>
                <!--1 to 500 repetitions:-->
                <departmentEmployee>
                    <name>string</name>
                    <surname>string</surname>
                    <patronim>string</patronim>
                    <dateOfBirth>2015-06-18+03:00</dateOfBirth>
                    <employeeDoc>
                        <docID>201</docID>
                    </employeeDoc>
                </departmentEmployee>
            </educationalMethodicalDepartment>
            <!--2 to 50 repetitions:-->
            <faculty>
                <facultyName>string</facultyName>
                <dean>
                    <name>string</name>
                    <surname>string</surname>
                    <patronim>string</patronim>
                    <dateOfBirth>2000-04-21+04:00</dateOfBirth>
                    <employeeDoc>
                        <docID>201</docID>
                    </employeeDoc>
                </dean>
                <kafedra>
                    <kafedraName>string</kafedraName>
                    <headTeacher>
                        <name>string</name>
                        <surname>string</surname>
                        <patronim>string</patronim>
                        <dateOfBirth>2017-04-19+03:00</dateOfBirth>
                        <employeeDoc>
                            <docID>201</docID>
                        </employeeDoc>
                    </headTeacher>
                    <!--2 to 50 repetitions:-->
                    <teacher>
                        <name>string</name>
                        <surname>string</surname>
                        <patronim>string</patronim>
                        <dateOfBirth>2008-08-06+04:00</dateOfBirth>
                        <employeeDoc>
                            <docID>201</docID>
                        </employeeDoc>
                    </teacher>
                    <teacher>
                        <name>string</name>
                        <surname>string</surname>
                        <patronim>string</patronim>
                        <dateOfBirth>2011-12-25</dateOfBirth>
                        <employeeDoc>
                            <docID>201</docID>
                        </employeeDoc>
                    </teacher>
                    <!--2 to 50 repetitions:-->
                    <group>
                        <groupName>string</groupName>
                        <year>2015+03:00</year>
                        <starosta>
                            <name>string</name>
                            <surname>string</surname>
                            <patronim>string</patronim>
                            <dateOfBirth>2018-07-19+03:00</dateOfBirth>
                            <studentDoc>
                                <docID>201</docID>
                            </studentDoc>
                        </starosta>
                        <!--5 to 70 repetitions:-->
                        <students>
                            <name>string</name>
                            <surname>string</surname>
                            <patronim>string</patronim>
                            <dateOfBirth>2004-12-06+03:00</dateOfBirth>
                            <studentDoc>
                                <docID>201</docID>
                            </studentDoc>
                        </students>
                        <students>
                            <name>string</name>
                            <surname>string</surname>
                            <patronim>string</patronim>
                            <dateOfBirth>2006-12-05</dateOfBirth>
                            <studentDoc>
                                <docID>201</docID>
                            </studentDoc>
                        </students>
                        <students>
                            <name>string</name>
                            <surname>string</surname>
                            <patronim>string</patronim>
                            <dateOfBirth>2016-09-11</dateOfBirth>
                            <studentDoc>
                                <docID>201</docID>
                            </studentDoc>
                        </students>
                        <students>
                            <name>string</name>
                            <surname>string</surname>